{
  "$schema": "../../../schemas/library-aids.schema.json",
  "version": "1.0.0",
  "generatedAt": "2026-09-03",
  "workId": "rti",
  "unitLabel": {
    "en": "Section",
    "hi": "धारा"
  },
  "disclaimer": {
    "en": "A study aid is Sahayak’s own explanation, not the text of the rule. Reference only; verify with the official gazette/order or your DDO.",
    "hi": "अध्ययन सहायिका सहायक की अपनी व्याख्या है, नियम का पाठ नहीं। केवल संदर्भ हेतु; आधिकारिक राजपत्र/आदेश अथवा अपने डीडीओ से सत्यापित करें।"
  },
  "source": {
    "name": "Department of Personnel and Training — Right to Information Act, 2005 — updated as on 18 November 2025",
    "url": "https://dopt.gov.in/sites/default/files/RTI%20Act%202005%20%28updated%20as%20on%2018-11-2025%29.pdf"
  },
  "aids": [
    {
      "id": "aid-rti-1",
      "workId": "rti",
      "unitId": "rti-1",
      "explanation": {
        "en": "Section 1 gives the Act its name, extends it to the whole of India, and splits its commencement in two. Section 4(1), sections 5(1) and 5(2), and sections 12, 13, 15, 16, 24, 27 and 28 came into force AT ONCE; everything else came into force on the one hundred and twentieth day after enactment. The split is why a public authority had to designate its Public Information Officers and publish its section 4 material before any citizen could file a request.",
        "hi": "धारा 1 अधिनियम को उसका नाम देती है, उसे संपूर्ण भारत तक विस्तारित करती है, और उसके प्रारंभ को दो भागों में बाँटती है। धारा 4(1), धारा 5(1) और 5(2), तथा धाराएँ 12, 13, 15, 16, 24, 27 और 28 तत्काल प्रवृत्त हुईं; शेष सब अधिनियमन के एक सौ बीसवें दिन। यही विभाजन कारण है कि किसी नागरिक के आवेदन करने से पूर्व ही लोक प्राधिकारी को अपने लोक सूचना अधिकारी नामित करने और धारा 4 की सामग्री प्रकाशित करनी पड़ी।"
      },
      "example": {
        "en": "The one-hundred-and-twenty-day gap was preparation time. Section 5 required designation within a hundred days of enactment, so the machinery existed before the right became exercisable.",
        "hi": "एक सौ बीस दिन का अंतराल तैयारी का समय था। धारा 5 अधिनियमन के सौ दिन के भीतर नामांकन अपेक्षित करती थी, अतः अधिकार प्रयोग-योग्य होने से पूर्व तंत्र विद्यमान था।"
      },
      "connects": [
        "rti-4",
        "rti-5"
      ],
      "misconception": {
        "en": "\"The whole Act started on one day.\" Nine provisions started at once and the rest a hundred and twenty days later, which is what the reference to section 4(1) and section 5(1)-(2) in sub-section (3) is doing.",
        "hi": "\"पूरा अधिनियम एक ही दिन आरंभ हुआ।\" नौ उपबंध तत्काल आरंभ हुए और शेष एक सौ बीस दिन बाद, और उप-धारा (3) में धारा 4(1) तथा धारा 5(1)-(2) का निर्देश यही कर रहा है।"
      },
      "reviewed": true,
      "reviewState": "approved",
      "generationMeta": {
        "promptVersion": "study-aid-v1",
        "batchId": "library-aids-2026-09-03-rti",
        "stageA": {
          "index": 1,
          "angle": "the two commencement dates inside one Act"
        },
        "critic": {
          "verdict": "approve",
          "reason": "The staged commencement is the only substantive thing in section 1 and it explains the design of sections 4 and 5."
        },
        "verify": {
          "grounded": true,
          "note": "The list of provisions in sub-section (3) and the one-hundred-and-twentieth-day formula are verbatim; the hundred-day designation period is read from section 5(1)-(2)."
        },
        "dedup": {
          "maxScore": 0,
          "against": null,
          "verdict": "keep"
        },
        "groundingUnitIds": [
          "rti-1",
          "rti-5"
        ]
      },
      "source": {
        "name": "Department of Personnel and Training — Right to Information Act, 2005 — updated as on 18 November 2025",
        "url": "https://dopt.gov.in/sites/default/files/RTI%20Act%202005%20%28updated%20as%20on%2018-11-2025%29.pdf"
      },
      "verify": true
    },
    {
      "id": "aid-rti-2",
      "workId": "rti",
      "unitId": "rti-2",
      "explanation": {
        "en": "\"Information\" is defined extremely widely — any material in any form, including records, documents, memos, e-mails, opinions, advices, press releases, circulars, orders, logbooks, contracts, reports, papers, samples, models and data in electronic form — and it reaches information about a PRIVATE body that a public authority can access under any other law. \"Public authority\" covers any authority, body or institution of self-government established by or under the Constitution, by an Act of Parliament or a State Legislature, or by notification, and includes a body owned, controlled or substantially financed by Government.",
        "hi": "\"सूचना\" अत्यंत व्यापक रूप से परिभाषित है — किसी भी रूप में कोई भी सामग्री, जिसमें अभिलेख, दस्तावेज़, ज्ञापन, ई-मेल, राय, सलाह, प्रेस विज्ञप्तियाँ, परिपत्र, आदेश, लॉगबुक, संविदाएँ, रिपोर्ट, कागज़ात, नमूने, प्रतिरूप तथा इलेक्ट्रॉनिक रूप में डेटा सम्मिलित हैं — और यह किसी निजी निकाय की उस सूचना तक भी पहुँचती है जिस तक लोक प्राधिकारी किसी अन्य विधि के अधीन पहुँच सकता है। \"लोक प्राधिकारी\" में संविधान द्वारा या उसके अधीन, संसद या राज्य विधान-मंडल की विधि द्वारा, अथवा अधिसूचना द्वारा स्थापित कोई भी प्राधिकारी, निकाय या स्वशासन संस्था आती है, और वह निकाय भी जो सरकार द्वारा स्वामित्वाधीन, नियंत्रित अथवा सारभूत रूप से वित्तपोषित है।"
      },
      "example": {
        "en": "A file noting is an \"opinion\" or an \"advice\" and is information. A private contractor’s records that the Ministry can call for under the contract are information too, because clause (f) reaches information relating to a private body accessible to a public authority under any other law.",
        "hi": "फ़ाइल की टिप्पणी \"राय\" या \"सलाह\" है और सूचना है। किसी निजी ठेकेदार के वे अभिलेख भी सूचना हैं जिन्हें मंत्रालय संविदा के अधीन मँगा सकता है, क्योंकि खंड (च) उस निजी निकाय संबंधी सूचना तक पहुँचता है जो किसी अन्य विधि के अधीन लोक प्राधिकारी को सुलभ हो।"
      },
      "connects": [
        "rti-3",
        "rti-6",
        "rti-8"
      ],
      "misconception": {
        "en": "\"Only formal records are information.\" The definition names opinions and advices, which is what makes a file noting disclosable in principle — subject to section 8.",
        "hi": "\"केवल औपचारिक अभिलेख ही सूचना हैं।\" परिभाषा राय और सलाह को नामित करती है, और यही फ़ाइल-टिप्पणी को सैद्धांतिक रूप से प्रकटन-योग्य बनाता है — धारा 8 के अधीन रहते हुए।"
      },
      "examRelevance": {
        "en": "Clause (f)’s reach into private-body information held accessible under another law, and clause (h)’s \"substantially financed\" limb, are the two parts asked about.",
        "hi": "खंड (च) की उस निजी-निकाय सूचना तक पहुँच जो किसी अन्य विधि के अधीन सुलभ हो, तथा खंड (ज) का \"सारभूत रूप से वित्तपोषित\" अंग — यही दो भाग पूछे जाते हैं।"
      },
      "reviewed": true,
      "reviewState": "approved",
      "generationMeta": {
        "promptVersion": "study-aid-v1",
        "batchId": "library-aids-2026-09-03-rti",
        "stageA": {
          "index": 2,
          "angle": "the two definitions that decide whether the Act applies at all"
        },
        "critic": {
          "verdict": "approve",
          "reason": "Only the two definitions that decide applicability are given; the rest of section 2 is met in context."
        },
        "verify": {
          "grounded": true,
          "note": "Clauses (f) and (h) are quoted in substance, including the private-body limb and the \"owned, controlled or substantially financed\" words."
        },
        "dedup": {
          "maxScore": 0,
          "against": null,
          "verdict": "keep"
        },
        "groundingUnitIds": [
          "rti-2"
        ]
      },
      "source": {
        "name": "Department of Personnel and Training — Right to Information Act, 2005 — updated as on 18 November 2025",
        "url": "https://dopt.gov.in/sites/default/files/RTI%20Act%202005%20%28updated%20as%20on%2018-11-2025%29.pdf"
      },
      "verify": true
    },
    {
      "id": "aid-rti-3",
      "workId": "rti",
      "unitId": "rti-3",
      "explanation": {
        "en": "Section 3 is the whole right: subject to the provisions of this Act, all CITIZENS shall have the right to information. Two words carry the qualifications — \"subject to the provisions of this Act\" is what lets sections 8, 9 and 24 cut it down, and \"citizens\" is what limits who may ask.",
        "hi": "धारा 3 ही पूरा अधिकार है: इस अधिनियम के उपबंधों के अधीन रहते हुए, सभी नागरिकों को सूचना का अधिकार होगा। दो शब्द ही सीमाएँ रखते हैं — \"इस अधिनियम के उपबंधों के अधीन रहते हुए\" वह है जो धाराओं 8, 9 और 24 को इसे घटाने देता है, और \"नागरिकों\" वह है जो सीमित करता है कि कौन माँग सकता है।"
      },
      "example": {
        "en": "A company or a foreign national is not a citizen, so the right in section 3 is not theirs. An Indian citizen resident abroad is one, and nothing in section 6 requires residence.",
        "hi": "कोई कंपनी अथवा विदेशी नागरिक नागरिक नहीं है, अतः धारा 3 का अधिकार उनका नहीं। विदेश में रहने वाला भारतीय नागरिक नागरिक है, और धारा 6 में निवास की कोई अपेक्षा नहीं।"
      },
      "connects": [
        "rti-2",
        "rti-6",
        "rti-8"
      ],
      "misconception": {
        "en": "\"Anyone can file an RTI.\" The right is a citizen’s. The Act does not confer it on a company, a firm or a non-citizen.",
        "hi": "\"कोई भी आरटीआई दाखिल कर सकता है।\" यह अधिकार नागरिक का है। अधिनियम इसे किसी कंपनी, फर्म अथवा गैर-नागरिक को प्रदान नहीं करता।"
      },
      "examRelevance": {
        "en": "Section 3 is one line and it is quoted verbatim in questions; the word to notice is \"citizens\".",
        "hi": "धारा 3 एक पंक्ति है और प्रश्नों में शब्दशः उद्धृत होती है; ध्यान देने योग्य शब्द है \"नागरिकों\"।"
      },
      "reviewed": true,
      "reviewState": "approved",
      "generationMeta": {
        "promptVersion": "study-aid-v1",
        "batchId": "library-aids-2026-09-03-rti",
        "stageA": {
          "index": 3,